<?xml version="1.0" encoding="UTF-8"?>
<xs:schema xmlns:xs="http://www.w3.org/2001/XMLSchema">

<!--El elemento biblioteca NO contiene solo texto así que es complexType. Aparece exactamente una vez.
Los elementos hijos de biblioteca deberán aparecer en orden por lo que empleados el indicador de orden
sequence. El orden será: comentario, libros, revistas, periódicos.-->
<xs:element name="biblioteca">
   <xs:complexType>
   <xs:sequence>
   
   <!--El elemento comentario contiene solo texto así que es simplexType. Aparece exactamente una vez.-->
   <xs:element name="comentario"/>
   
   <!--El elemento libros tiene los siguientes hijos y en este orden: libro-->
   <xs:element name="libros">
      <xs:complexType>
      <xs:sequence>
      <!--El elemento libro tiene los siguientes hijos y en este orden: título, capítulos, índice, sinopsis.
      El elemento libro tiene por atributos tipo_clase, Id, autor, edición, nombre_editorial y n_páginas-->
      <xs:element name="libro" maxOccurs="unbounded">
         <xs:complexType>
         <xs:sequence>
         <xs:element name="título" type="xs:string"/>
         <!--El elemento capítulos tiene los siguientes hijos y en este orden: capítulo-->
         <xs:element name="capítulos">
            <xs:complexType>
            <xs:sequence>
            <!--El elemento capítulo tiene los siguientes hijos y en este orden: título, contenido.
            El elemento capítulo tiene por atributos idcap y n_páginas-->
            <xs:element name="capítulo" maxOccurs="unbounded">
               <xs:complexType>
               <xs:sequence>
               <!--El elemento título solo tiene texto y aparece entre 0 y 1 veces-->
               <xs:element name="título" type="xs:string" minOccurs="0"/>
               <!--El elemento contenido no tiene hijos y tiene un único atributo llamado enlace-->
               <xs:element name="contenido">               
                  <xs:complexType>
                  <xs:attribute name="enlace" type="xs:string"/>            
                  </xs:complexType>
               </xs:element>
               </xs:sequence>
               <xs:attribute name="idcap" type="xs:string" use="required"/>
               <xs:attribute name="n_páginas" type="xs:positiveInteger"/>
               </xs:complexType>
            </xs:element>
            </xs:sequence>
            </xs:complexType>
         </xs:element>
         <xs:element name="índice" type="xs:string"/>
         <xs:element name="sinopsis" type="xs:string"/>
         </xs:sequence>
         <!--El atributo tipo_clase debe aparecer y debe ser uno de entre novela, infantil, didáctico-->
         <xs:attribute name="tipo_clase" use="required">
            <xs:simpleType>
            <xs:restriction base="xs:string">
               <xs:pattern value="novela|infantil|didáctico"/>
               <!-- Otra opción equivalente sería
                xs:enumeration value="novela"/>
               <xs:enumeration value="infantil"/>
               <xs:enumeration value="didáctico"/> -->
            </xs:restriction>
            </xs:simpleType>
         </xs:attribute>
         <!--El atributo Id debe aparecer y consta de 5 caracteres siendo el primero de ellos la letra L y
         los cuatro siguientes dígitos-->
         <xs:attribute name="Id" use="required">
            <xs:simpleType>
            <xs:restriction base="xs:string">
               <xs:pattern value="L[0-9][0-9][0-9][0-9]"/>
            </xs:restriction>
            </xs:simpleType>
         </xs:attribute>   
         <xs:attribute name="autor" type="xs:string"/>
         <xs:attribute name="año_edición" type="xs:gYear" use="required"/>
         <xs:attribute name="nombre_editorial" type="xs:string"/>
         <xs:attribute name="n_páginas" type="xs:positiveInteger"/>    
         </xs:complexType>
      </xs:element>
      </xs:sequence>
      </xs:complexType>   
   </xs:element>
   
   <xs:element name="revistas">
      <xs:complexType>
      <xs:sequence>
      <xs:element name="revista" maxOccurs="unbounded">
         <xs:complexType>
         <xs:sequence>
         <xs:element name="título" type="xs:string"/>
         <xs:element name="n_revista" type="xs:positiveInteger"/>
         <xs:element name="índice_de_contenido" type="xs:string"/>
         <xs:element name="secciones">
            <xs:complexType>
            <xs:sequence>
            <xs:element name="sección" maxOccurs="unbounded">
               <xs:complexType>
               <xs:sequence>
               <xs:element name="título" type="xs:string"/>
               <xs:element name="contenido">
                  <xs:complexType>
                  <xs:attribute name="enlace" type="xs:string"/>            
                  </xs:complexType>
               </xs:element>
               </xs:sequence>
               <xs:attribute name="idsec" type="xs:nonNegativeInteger" use="required"/>
               <xs:attribute name="n_páginas" type="xs:positiveInteger"/>
               </xs:complexType>
            </xs:element>
            </xs:sequence>
            </xs:complexType>
        </xs:element>
        </xs:sequence>
        <xs:attribute name="Id" use="required">
            <xs:simpleType>
            <xs:restriction base="xs:string">
               <xs:pattern value="R([a-zA-Z0-9])*"/>
            </xs:restriction>
            </xs:simpleType>
         </xs:attribute> 
         <xs:attribute name="tipo_clase" use="required">
   
            <xs:simpleType>
            <xs:restriction base="xs:string">
               <xs:pattern value="informática|corazón|coches|investigación|otras"/>
            </xs:restriction>
            </xs:simpleType>
         </xs:attribute>
         <xs:attribute name="n_páginas" type="xs:positiveInteger"/>  
         </xs:complexType>
      </xs:element>
      </xs:sequence>
      </xs:complexType>     
   </xs:element>
   
   <xs:element name="periódicos">
      <xs:complexType>
      <xs:sequence>
      <xs:element name="periódico" maxOccurs="unbounded">
         <xs:complexType>
         <xs:sequence>
         <xs:element name="índice" type="xs:string"/>
         <xs:element name="secciones">
            <xs:complexType>
            <xs:sequence>
            <xs:element name="sección" maxOccurs="unbounded">
               <xs:complexType>
               <xs:sequence>
               <xs:element name="artículo" maxOccurs="unbounded">
                  <xs:complexType>
                  <xs:sequence>
                  <xs:element name="título" type="xs:string"/>
                  <xs:element name="contenido">
                     <xs:complexType>
                     <xs:attribute name="enlace" type="xs:string"/>            
                     </xs:complexType>
                  </xs:element>
                  </xs:sequence>
                  <xs:attribute name="autor" type="xs:string"/>  
                  </xs:complexType>
               </xs:element>
               </xs:sequence>
               <xs:attribute name="tipo_sección" use="required">
                  <xs:simpleType>
                  <xs:restriction base="xs:string">
                     <xs:pattern value="opinión|nacional|internacional|económica|deportes"/>
                  </xs:restriction>
                  </xs:simpleType>
               </xs:attribute>
               <xs:attribute name="n_páginas" type="xs:positiveInteger"/>   
               </xs:complexType>   
            </xs:element>
            </xs:sequence>
            </xs:complexType>
         </xs:element>
         </xs:sequence>
         <xs:attribute name="Id" use="required">
            <xs:simpleType>
            <xs:restriction base="xs:string">
               <xs:pattern value="P[0-9][0-9][0-9][0-9]"/>
            </xs:restriction>
            </xs:simpleType>            
         </xs:attribute>
         <xs:attribute name="tipo_clase" use="required">   
            <xs:simpleType>
            <xs:restriction base="xs:string">
               <xs:pattern value="nacional|internacional"/>
            </xs:restriction>
            </xs:simpleType>
         </xs:attribute>
         <xs:attribute name="nombre" type="xs:string" use="required"/>
         <xs:attribute name="fecha_publicación" type="xs:date" use="required"/>
         <xs:attribute name="n_páginas" type="xs:positiveInteger"/>    
         </xs:complexType>
      </xs:element>
      </xs:sequence>
      </xs:complexType>
   </xs:element>
   
   </xs:sequence>
   </xs:complexType>
</xs:element>
   
</xs:schema>
